75,9780060004446,"Power Plays (Win or Lose--How History's Great Political Leaders Play the Game)",17.99,2.10217,15,3,2003,21335,"Dick Morris is one of the frankest and most incisive political observers in America today. A fiercely intelligent presidential advisor and a popular columnist and political analyst for the Fox News Channel, Morris now brings his brilliant strategic mind to this fascinating survey of the most dramatic political moves in history."
76,9780060004705,"Engaged to Die (A Death on Demand Mystery)",7.99,1.43813,3,3,2004,477422,"When wealthy, widowed art patron Virginia Neville officially announces her engagement to Jake O'Neill -- her handsome, charming, and much younger fiancé -- at a gala gallery opening, not all the gathered friends and stepfamily are pleased. And before the last champagne bubble pops, murder disrupts the grand celebration. Bookstore owner Annie Darling has a vested interest in the investigation, and she's determined to untangle an unholy marriage of jealousy, blackmail, and malicious mischief, even if it means having to cross swords with hubby Max and cross paths with a cruelly clever stalker."
77,9780060004750,"Murder Walks the Plank (A Death on Demand Mystery)",6.99,1.63481,3,1,2005,910094,"Annie Darling's murder mystery cruise in the waters off her not-always-idyllic isle of Broward's Rock is going swimmingly -- until one of the revelers plunges overboard. And despite hubby Max's courageous rescue attempt, faux murder turns all too quickly into real-life death. As the body count rises over the next few days, the popular proprietress of the Death on Demand bookstore begins to suspect that all the victims were murdered most foully, and that they are all connected in some unknown way. But what intrepid crime solver Annie does not realize is that the killer she seeks is more ingeniously efficient than most -- and the puzzle she wishes to unravel is, in reality, a time bomb packed with an explosive mix of arson, assault, kidnapping, robbery ... and homicide, naturally."
78,9780060004774,"Death of the Party",7.99,3.48527,3,3,2006,21804,"Britt Barlow is certain her media mogul brother-in-law Jeremiah Addison's fatal tumble a year ago was no accident -- especially since she herself discovered, and disposed of, the trip wire someone had strung across the stairs. Now she's bringing all who were in attendance that weekend back to Golden Silk -- Addison's luxurious secluded island estate -- and inviting two extra guests, Annie and Max Darling, to help uncover a killer."
79,9780060004798,"Mrs. McNosh Hangs Up Her Wash",7.99,2.79477,1,1,2002,479850,"Mrs. McNosh's wash is certainly big-and definitely wacky. You'll be surprised to see what is hanging on her clothesline by the end of the day!"
80,9780060004903,"World Gone By (A Novel)",27.99,4.9848,3,1,2015,642130,"Dennis Lehane, the New York Times bestselling author of Live by Night—now a Warner Bros. movie starring Ben Affleck—delivers a psychologically, morally complex novel of blood, crime, passion, and vengeance, set in Cuba and Ybor City, Florida, during World War II, in which Joe Coughlin must confront the cost of his criminal past and present."
81,9780060005719,"The Brewmaster's Table (Discovering the Pleasures of Real Beer with Real Food)",19.99,1.77235,16,1,2005,475743,"Winner of the International Association of Culinary Professionals’ Award for Best Cookbook in the Wine, Beer or Spirits category."
82,9780060005771,"The Story of the Trapp Family Singers",16.99,1.04944,5,3,2001,894584,"With nearly 1,500 Broadway performances, six Tony Awards, more than three million albums sold, and five Academy Awards, The Sound of Music, based on the lives of Maria, the baron, and their singing children, is as familiar to most of us as our own family history. But much about the real-life woman and her family was left untold."
83,9780060006228,"How to Talk to Your Cat",7.99,4.10688,1,1,2003,4071,"Jean Craighead George, Newbery Medal-winning author of over 80 books about nature and animals, demonstrates in words and photos how to communicate with that ever-mysterious, ever-lovable animal -- the cat."
84,9780060006235,"How to Talk to Your Dog",7.99,2.52878,24,3,2003,800324,"Jean Craighead George, Newbery Medal -- winning author of over 80 books about nature and animals, demonstrates in words and photos how to communicate with your best friend."
85,9780060006792,"The Agile Gene (How Nature Turns on Nurture)",17.99,2.33542,27,1,2004,110223,"Armed with extraordinary new discoveries about our genes, acclaimed science writer Matt Ridley turns his attention to the nature-versus-nurture debate in a thoughtful book about the roots of human behavior."
86,9780060007287,"A Fine, Fine School",7.99,4.0405,1,2,2003,439036,"A Fine, Fine School is a delight for kids, with its colorful illustrations and gentle comeuppance for a well-meaning principal who learns that learning outside of school can be just as important as being in school."
87,9780060007447,"Writings on an Ethical Life",16.99,4.14658,31,3,2001,389177,"Love him or hate him, you certainly can't ignore him. For the past twenty years, Australian philosopher and professor of bioethics Peter Singer has pushed the hot buttons of our collective conscience. In addition to writing the book that sparked the modern animal rights movement, Singer has challenged our most closely held beliefs on the sanctity of human life, the moral obligation's of citizens of affluent nations toward those living in the poorest countries of the world, and much more, with arguments that intrigue as often and as powerfully as they incite."
88,9780060007676,"Surviving Hitler (A Boy in the Nazi Death Camps)",7.99,3.29092,1,2,2002,616860,"The life-changing story of a young boy’s struggle for survival in a Nazi-run concentration camp. Narrated in the voice of Holocaust survivor Jack Mandelbaum, this harrowing true story includes black-and-white photos from the archives of the U.S. Holocaust Memorial Museum."
89,9780060007799,"The Blackbirder (Book Two of the Brethren of the Coast)",15.99,2.6339,3,2,2002,933872,"In a blind rage, King James, ex-slave and now Marlowe's comrade in arms, slaughters the crew of a slave ship and makes himself the most wanted man in Virginia. The governor gives Marlowe a choice: Hunt James down and bring him back to hang or lose everything Marlowe has built for himself and his wife, Elizabeth."
90,9780060007942,"Ruby Ridge (The Truth and Tragedy of the Randy Weaver Family)",16.99,2.26119,9,3,2002,236324,"On the last hot day of summer in 1992, gunfire cracked over a rocky knob in northern Idaho, just south of the Canadian border. By the next day three people were dead, and a small war was joined, pitting the full might of federal law enforcement against one well-armed family. Drawing on extensive interviews with Randy Weaver's family, government insiders, and others, Jess Walter traces the paths that led the Weavers to their confrontation with federal agents and led the government to treat a family like a gang of criminals."
91,9780060007997,"For Parents and Teenagers (Dissolving the Barrier Between You and Your Teen)",13.99,1.91116,11,1,2003,938912,"The author of Choice Theory and Reality Therapy offers a powerful approach for helping troubled teens."
92,9780060008017,"Beyond Genetics (The User's Guide to DNA)",13.95,1.11838,11,3,2004,710800,"Genetic science is about to radically alter our lives. Sooner than you can imagine, human beings will be capable of diagnosing their own illnesses, designating the sex of their children, even designing the food they eat -- all as easily as using a cell phone. Now is the time for every one of us to take control of our DNA, and one man is uniquely qualified to show us how: Glenn McGee, bioethicist at the University of Pennsylvania, pioneer in the study of ""home genetics,"" and the acknowledged wunderkind of the exciting world found at the nexus of life science and computer technology."
93,9780060008468,"The Earth Dragon Awakes (The San Francisco Earthquake of 1906)",7.99,2.65019,1,2,2008,112617,"Over the years the earth has moved many times under San Francisco. But it has been thirty-eight years since the last strong earthquake. People have forgotten how bad it can be. But soon they will remember."
94,9780060008734,"Democracy in America: Abridged Edition",16.99,2.54182,15,3,2007,953340,"The abridged edition of the enduring masterwork—a classic portrait of America's culture and people"
95,9780060008819,"Dot.con (How America Lost Its Mind and Money in the Internet Era)",17.99,3.35255,32,2,2003,552716,"The Internet stock bubble wasn't just about goggle-eyed day traderstrying to get rich on the Nasdaq and goateed twenty-five-year-olds playing wannabe Bill Gates. It was also about an America that believed it had discovered the secret of eternal prosperity: it said something about all of us, and what we thought about ourselves, as the twenty-first century dawned. John Cassidy's Dot.con brings this tumultuous episode to life. Moving from the Cold War Pentagon to Silicon Valley to Wall Street and into the homes of millions of Americans, Cassidy tells the story of the great boom and bust in an authoritative and entertaining narrative. Featuring all the iconic figures of the Internet era -- Marc Andreessen, Jeff Bezos, Steve Case, Alan Greenspan, and many others -- and with a new Afterword on the aftermath of the bust, Dot.con is a panoramic and stirring account of human greed and gullibility."
96,9780060008918,"Until Death Do Us Part (My Struggle to Reclaim Colombia)",15.99,1.44753,20,3,2008,566625,"In 2002, Colombian senator, anticorruption crusader, and presidential candidate Ingrid Betancourt was kidnapped by leftist guerrillas. She was their prisoner for more than six years. Until now."
97,9780060008956,"Dharma Punx",16.99,1.55004,8,3,2004,226666,"Fueled by the music of revolution, anger, fear, and despair, we dyed our hair or shaved our heads ... Eating acid like it was candy and chasing speed with cheap vodka, smoking truckloads of weed, all in a vain attempt to get numb and stay numb."
98,9780060009052,"Mary Ingalls on Her Own",16.99,1.47776,4,1,2007,442818,"Mary IngalLs lost her sight after a devastating bout of scarlet fever. Now Mary has the opportunity to attend the Iowa College for the Blind, where she will get a fresh start with her education and can learn the skills she needs for an independent future as well."
99,9780060009243,"See Jane Score",8.99,3.52187,3,2,2003,295974,"Award–winner and USA Today bestselling author Rachel Gibson's smart, sassy contemporary romances are making her one of the genre's fastest rising stars."
100,9780060009366,"Cooking the RealAge (R) Way (Turn back your biological clock with more than 80 delicious and easy recipes)",14.95,2.64892,16,1,2006,665327,"The #1 New York Times bestselling author of RealAge® and coauthor of You: The Owner's Manual shows you how to cook your way to a younger you."
101,9780060009380,"The RealAge(R) Workout (Maximum Health, Minimum Work)",17.99,4.78192,16,1,2007,621471,"With his bestselling books, Dr. Michael F. Roizen has helped people reverse their chronological aging by ten, fifteen, and up to twenty-nine years. Now, with The RealAge® Workout, he explains the importance of gradually phasing exercise into your everyday routine, because even the smallest changes in behavior can make you feel, look, and be younger. No matter how busy your schedule, Dr. Michael Roizen will show you how to gain the maximum age-reduction benefits from a minimum amount of time and effort. He'll help you create an exercise program that meets your needs and he'll offer tips on how to actually enjoy—yes, even love—exercise. So get ready to achieve optimal health and be as young as you can be!"
102,9780060010126,"Owen's Marshmallow Chick",7.99,2.56161,4,3,2002,12108,"""My favorite,"" said Owen when he saw the marshmallow chick."
103,9780060011079,"Miss Lady Bird's Wildflowers (How a First Lady Changed America)",17.99,1.70263,24,3,2005,404311,"Bluebonnets and lady's slippers, larkspurs and blazing stars, black-eyed Susans and Granny's nightcaps."
104,9780060011109,"¿El canguro tiene mamá? (Does a Kangaroo Have a Mother, Too? (Spanish edition))",17.99,2.74768,4,3,2002,352437,"This high-quality Spanish-language book can be enjoyed by fluent Spanish speakers as well as those learning the language, whether at home or in a classroom."
105,9780060011307,"The Mexicans (A Personal Portrait of a People)",15.99,4.33802,9,1,2002,28223,"The Mexicans is a multifaceted portrait of the complex, increasingly turbulent neighbor to our south. It is the story of a country in crisis -- poverty, class tensions, political corruption -- as told through stories of individuals."
106,9780060011383,"The Harlem Hellfighters (When Pride Met Courage)",9.99,4.10013,1,2,2014,12515,"New York Times bestselling author Walter Dean Myers and renowned filmmaker Bill Miles deftly tell the true story of the unsung American heroes of the 369th Infantry Regiment of World War I in The Harlem Hellfighters: When Pride Met Courage."
107,9780060011604,"Robert Young Pelton's The World's Most Dangerous Places (5th Edition)",25.99,3.89146,34,1,2003,567804,"Robert Young Pelton, a professional adventurer, and his team of international war correspondents have updated this indispensable handbook for the intrepid adventurer-- a ""how-to"" in getting in and out of the world′s hot spots."
108,9780060011628,"Republica de East LA, La (Cuentos)",12.99,2.00132,3,1,2003,853206,"This book title, Republica de East LA, La (Cuentos), ISBN: 9780060011628, by Luis J. Rodriguez, published by HarperCollins (March 4, 2003) is available in paperback. Our minimum order quantity is 25 copies. All standard bulk book orders ship FREE in the continental USA and delivered in 4-10 business days."
109,9780060012137,"Annie, Between the States",10.99,4.50755,6,2,2006,628680,"Annie's home and heart are divided by the Civil War."
110,9780060012236,"Geography Club",9.99,1.69675,6,3,2004,144021,"A modern classic about a group of teens discovering sexuality and identity, perfect for fans of Becky Albertalli, Adam Silvera, and David Levithan."
111,9780060012779,"Parts Unknown (A Novel)",14.99,3.89108,3,2,2004,565656,"As a young man, Bill Argus abandoned his wife, their young son, and his family's dairy farm in the Sonoma County hamlet of Pianto. Now sixty-three, the once-famous photographer is overcome with the need to find forgiveness from those he left behind. Journeying back to the small dreary California town, he is disoriented after finding a ragged skeleton of the boyhood farm he remembers, and a family unmoved and indifferent to his return."
112,9780060012786,"A Cook's Tour (Global Adventures in Extreme Cuisines)",16.99,2.07843,5,1,2002,838537,"From the star of No Reservations, Anthony Bourdain's New York Times-bestselling chronicle of travelling the world in search the globe's greatest cuilnary adventures"
113,9780060013165,"Monstrous Regiment",7.99,1.95047,3,3,2004,804571,"War has come to Discworld ... again."
114,9780060013233,"The High-Rise Private Eyes #4: The Case of the Troublesome Turtle",4.99,1.13895,4,3,2002,606189,"Mr. Paris ties balloons outside his toy store every morning. On Fridays, the balloons disappear! What is special about Fridays? And who is taking the balloons?"
115,9780060013547,"Beetle McGrady Eats Bugs!",17.99,2.15287,4,3,2005,399278,"BEETLE MCGRADY EATS BUGS"
116,9780060014018,"The Greatest Stories Never Told (100 Tales from History to Astonish, Bewilder, and Stupefy)",19.99,4.37254,9,3,2003,699289,"History isn't always made by great armies colliding or by great civilizations rising or falling. Sometimes it's made when a chauffeur takes a wrong turn, a scientist forgets to clean up his lab, or a drunken soldier gets a bit rowdy. That's the kind of history you'll find in The Greatest Stories Never Told."
117,9780060014216,"Calling Doctor Amelia Bedelia",16.99,3.19654,4,1,2002,402048,"Date: A hot day in August."
118,9780060014315,"kids are worth it! Revised Edition (Giving Your Child the Gift of Inner Discipline)",16.99,2.91471,14,2,2002,496234,"The parenting classic, now revised with new chapters, checklists, and information about today's most pressing issues regarding our children"
119,9780060080662,"The Wizard Mouse",16.99,4.04249,4,3,2011,120675,"A field mouse’s place is in the field—or so say Rollie’s father, his grandfather, and everyone he has ever known."
120,9780060080839,"After",9.99,4.9052,6,3,2004,593992,"School has become a prison.
No one knows why.
There's no way to stop it."
121,9780060080853,"Guided Tours of Hell (Novellas)",14.95,2.68878,3,3,2002,67725,"The less-than-innocents abroad in these short novels are Americans in Europe, involved in what turn out to be pleasure tours of hell: shocking, bewildering trips that change forever their ideas about history, reality, politics, sex -- their entire lives."
122,9780060080921,"Good Driving, Amelia Bedelia",4.99,4.94315,4,1,2002,11380,"When Mr. Rogers goes for a drive with Amelia Bedelia, he's in for the ride of his life. She does exactly what he tells her –– and that gets them into trouble, but only Amelia Bedelia can make a car trip this much fun!"
123,9780060081584,"The Dance of Fear (Rising Above Anxiety, Fear, and Shame to Be Your Best and Bravest Self)",15.99,4.65948,11,1,2005,130622,"Unhappiness, says bestselling author Harriet Lerner, is fueled by three key emotions: anxiety, fear, and shame. They are the uninvited guests in our lives. When tragedy or hardship hits, they may become our constant companions."
124,9780060081713,"Mary Engelbreit's Mother Goose (One Hundred Best-Loved Verses)",19.99,4.31254,1,1,2005,22743,"New York Times bestseller!"
125,9780060081904,"Queen of Halloween",17.99,2.2751,4,3,2008,162209,"Wearing the perfect fairy queen costume, with her friend Michael by her side, Ann Estelle is ready for a Halloween night on the town. And what a night it is—full of ghosts and mummies and witches and wizards, and lots of candy, of course."
126,9780060081935,"Courting Trouble",26.95,3.60815,3,3,2002,19884,"In Courting Trouble, New York Times bestselling author Lisa Scottoline is back with another fast-paced thriller that sends a young woman lawyer racing to find out who's trying to kill her -- after she's wrongly been reported murdered."
127,9780060081973,"Once Upon a Town (The Miracle of the North Platte Canteen)",16.99,1.5966,9,3,2003,816586,"In search of ""the best America there ever was,"" bestselling author and award-winning journalist Bob Greene finds it in a small Nebraska town few people pass through today—a town where Greene discovers the echoes of the most touching love story imaginable: a love story between a country and its sons."
128,9780060081997,"The Fall of Advertising and the Rise of PR",14.99,3.07692,26,3,2004,968133,"Bestselling authors and world-renowned marketing strategists Al and Laura Ries usher in the new era of public relations."
129,9780060082222,"Thyroid Power (Ten Steps to Total Health)",14.99,4.47314,2,2,2002,607545,"Fatigue; weight gain; depression; arthritis; high cholestrol; low sex drive; skin, digestive, and female problems; abnormal blood pressure -- all may be symptoms of low thyroid, one of the most misdiagnosed disorders in America."
130,9780060082710,"The Receiving (Reclaiming Jewish Women's Wisdom)",13.95,4.41168,8,3,2004,200558,"A highly respected rabbi, therapist, and teacher restores women's spiritual lineage to Judaism and empowers women to reclaim their rightful connection to Jewish teachings, Kabbalah, and to their own spiritual wisdom."
131,9780060082741,"Gallows Thief (A Novel)",16.99,1.50837,3,3,2005,275307,"The year is 1820. Rider Sandman, a hero of Waterloo, returns to London to wed his fiancée. But instead of settling down to fame and glory, he finds himself penniless in a country where high unemployment and social unrest rage, and where men—innocent or guilty—are hanged for the merest of crimes."
132,9780060084066,"The Hunted",7.99,4.17881,3,3,2003,335264,"“Wonderful…razor-sharp.”
—Los Angeles Times Book Review"
133,9780060084370,"Somewhere South of Here (A Novel)",14.99,3.38656,3,2,2002,503983,"I'd wondered about my mother all my life -- what she looked like, how she smelled and sounded and acted. Lately this wondering had grown to encompass a curiosity about the kind of people she herself came from, because they were my family, too, after all, even though I knew nothing about them. I'd no idea whether they were loud or soft-spoken, funny or boring, preferred chocolate to vanilla, if they liked movies over books or the other way around. I wondered whether any of them had ever done anything magnificent in their lives, or if they were the kind of folks who were satisfied with just getting by. These things were important -- knowing them would help me to know myself, and the only way that would happen was if I went and looked for her."
134,9780060084424,"A Visionary Nation (Four Centuries of American Dreams and What Lies Ahead)",14.99,4.03546,26,2,2002,255624,"In this penetrating volume, Zachary Karabell examines the continuous thread that runs through the tapestry of the American experience -- the belief that we can create a perfect society -- and envisions what the next great era will be. Just as the Puritan vision of a city on a hill was supplanted by the Founding Fathers' vision of individuality, just as the expansive vision of a government-led Great Society was eclipsed by the New Economy of the 1990s, so too is the New Economy being replaced by what Karabell contends will be a period when community and spirituality occupy center stage."
135,9780060085568,"Charmed Lives (A Family Romance)",16.99,4.59316,9,2,2002,576456,"A Rolls Royce Silver Cloud drove him to airports; the British film industry kowtowed to his power; the great Hollywood studios fawned at his feet.Sir Alexander Korda, one of the world's most flamboyant movie tycoons, rose from obscurity in rural Hungary to become a legendary filmmaker. With him were his brothers, Zoltan and Vincent, all living charmed lives in circles that included H. G. Wells, Sir Lawrence Olivier, Marlena Dietrich, Vivien Leigh, and Merle Oberon, who was soon to be Alex's wife. But along with Alex's flair for success was an equally powerful impulse for destruction. Now, Vincent's son, Michael Korda, in the first book of his memoirs, recalls the enchanted figures of his childhood...the glory days of the Korda brothers' great films...and then their heartbreaking, tragic end."
136,9780060085605,"One Candle",7.99,3.63695,4,3,2004,806502,"For one family the traditional Hanukkah celebration has a deeper meaning. Amidst the food and the festivities, Grandma and Great-Aunt Rose begin their story -- the one they tell each year. They pass on to each generation a tale of perseverance during the darkest hours of the Holocaust, and the strength it took to continue to honor Hanukkah in the only way they could. Their story reaffirms the values of tradition and family, but also shows us that by continuing to honor the tragedies and the triumphs of the past there will always be hope for the future."
137,9780060086121,"The RealAge Diet (Make Yourself Younger with What You Eat)",13.95,1.86303,16,1,2002,83043,"Dr. Michael Roizen presents his program for eating the RealAge way: a diet that is good for your overall health, plus works to delay or even reverse aging. If there's one thing you will learn from this book, it's that no matter who you are, if you eat foods that are high in nutrients and low in calories you will be on the road to renewed health and vitality."
138,9780060086619,"El león, la bruja y el ropero (The Lion, the Witch and the Wardrobe (Spanish edition))",9.99,1.66981,4,1,2002,803322,"This high-quality Spanish-language book can be enjoyed by fluent Spanish speakers as well as those learning the language, whether at home or in a classroom."
139,9780060086657,"Scimitar SL-2",7.99,3.63355,3,2,2005,141010,"A massive tsunami triggered by a terrifying weapon in the hands of a madman ..."
140,9780060087463,"On the Run (An Angler's Journey Down the Striper Coast)",14.99,2.96495,18,2,2004,438934,"Each autumn, one of nature's most magnificent dramas plays out when striped bass undertake a journey, from the northeastern United States to the Outer Banks of North Carolina, in search of food and warmer seas. Writer and angler David DiBenedetto followed this great migration -- the fall run -- for three months in the autumn of 2001."
141,9780060087722,"French Food at Home",15.99,3.43743,16,3,2005,16968,"The French cooking of everyday life is lighthearted, accessible, and suited to modern tastes. Whether it's getting weeknight dinners on the table fairly fast (Basil Beef, Rhubarb Chops, or Carrot Juice Chicken) or leisurely cooking for dining at a slightly slower pace (Lamb Tagine, Holiday Hen, or Fennel Bass), Laura Calder shares recipes she's created at home in her own French kitchen."
142,9780060088613,"Fire",13.99,4.92902,39,3,2002,680039,"A riveting collection of literary journalism by the bestselling author of The Perfect Storm, capped off brilliantly by a new Afterword and a timely essay about war-torn Afghanistan -- a superb eyewitness report about the Taliban's defeat in Kabul -- new to book form."
143,9780060088781,"Evolution's Captain (The Story of the Kidnapping That Led to Charles Darwin's Voyage Aboard the Beagle)",15.99,3.87193,27,1,2004,785105,"This is the story of the man without whom the name Charles Darwin might be unknown to us today. That man was Captain Robert FitzRoy, who invited the 22-year-old Darwin to be his companion on board the Beagle ."
144,9780060088828,"Bobbi Brown Beauty Evolution (A Guide to a Lifetime of Beauty)",18.95,3.68809,33,2,2005,424885,"A celebration of beauty across the generations."
