1,9780060001261,"Less Than Zero",5.99,1.36051,1,2,2003,147613,"Perry the Penguin needs 9 clams to buy an ice scooter -- but he's not very good at saving. As Perry earns, spends, finds, loses, and borrows clams, a simple line graph demonstrates the concept of negative numbers."
2,9780880014977,"In The Garden Of The North American Martyrs (Stories)",13.95,4.90143,3,3,2004,92849,"Among the characters you'll find in this collection of twelve stories by Tobias Wolff are a teenage boy who tells morbid lies about his home life, a timid professor who, in the first genuine outburst of her life, pours out her opinions in spite of a protesting audience, a prudish loner who gives an obnoxious hitchhiker a ride, and an elderly couple on a golden anniversary cruise who endure the offensive conviviality of the ship's social director."
3,9780060511166,"Amelia Bedelia's Family Album",4.99,3.29998,4,1,2003,909036,"Who could be more zany than Amelia Bedelia, everyone's favorite literal-minded housekeeper? Her family, of course! Meet the wacky members of this very original and entertaining family!"
4,9780060513139,"De la cabeza a los pies (From Head to Toe (Spanish edition))",8.99,2.63537,1,2,2007,605461,"This high-quality Spanish-language book can be enjoyed by fluent Spanish speakers as well as those learning the language, whether at home or in a classroom."
5,9780060514099,"Molly Moon's Incredible Book of Hypnotism",7.99,4.89488,4,3,2004,503413,"Molly Moon is no ordinary orphan. When she finds a mysterious old book on hypnotism, she discovers she can make people do whatever she wants. But a sinister stranger is watching her every move and he'll do anything to steal her hypnotic secret..."
6,9780060515805,"Walk This Way (The Autobiography of Aerosmith)",16.99,1.79145,5,3,2003,433822,"Walk This Way: The Autobiography of Aerosmith is available in time for the Aerosmith's 40th Anniversary. It's the New York Times bestselling autobiography by the legendary rock group that lived by the motto ""Anything worth doing was worth overdoing."" Aerosmith shook the music world out of its '70s doldrums…and made living on the edge an art form. Walk This Way is the complete and candid story of their meteoric rise to fame, their near destruction due to drugs and excess, and their return to the stage as one of America's greatest rock bands. Cowritten by respected rock journalist Stephen Davis, author of the seminal profile of Led Zeppelin, Hammer of the Gods, and with a new afterward from the band, this edition of the memoir to end all rock memoirs is the perfect  gift for you and your favorite Aerosmith fan."
7,9780876859810,"Living On Luck",18.99,4.0751,7,3,2002,365790,"Living on Luck is a collection of letters from the 1960s mixed in with poems and drawings. The ever clever Charles Bukowski fills the pages with his rough exterior and juicy center."
8,9780060566760,"Hell at the Breech (A Novel)",15.99,2.88549,3,3,2003,580367,"In 1897, an aspiring politician is mysteriously murdered in the rural area of Alabama known as Mitcham Beat. His outraged friends -- —mostly poor cotton farmers -- form a secret society, Hell-at-the-Breech, to punish the townspeople they believe responsible. The hooded members wage a bloody year-long campaign of terror that culminates in a massacre where the innocent suffer alongside the guilty. Caught in the maelstrom of the Mitcham war are four people: the aging sheriff sympathetic to both sides; the widowed midwife who delivered nearly every member of Hell-at-the-Breech; a ruthless detective who wages his own war against the gang; and a young store clerk who harbors a terrible secret."
9,9780060557737,"Hamster Champs",6.99,2.00975,1,2,2005,1284,"Stuart J. Murphy travels all over the UnitedStates talking to thousands of kids. And you'll never believe what they talk about: MATH! Stuart shows kids that they use math every day -- to share a pizza, spend their allowance, even sort socks. Stuart writes funny stories about math -- and if you read his books, you'll start to see the fun in math, too."
10,9780060566166,"A Year with C. S. Lewis (Daily Readings from His Classic Works)",24.99,1.42517,8,2,2003,729260,"The classic A Year with C.S. Lewis is an intimate day-to-day companion by C.S. Lewis, the most important Christian writer of the 20th century. The daily meditations have been culled from Lewis’ celebrated signature classics: Mere Christianity, The Screwtape Letters, The Great Divorce, The Problem of Pain, Miracles, and A Grief Observed, as well as from the distinguished works The Weight of Glory and The Abolition of Man. Ruminating on such themes as the nature of love, the existence of miracles, overcoming a devastating loss, and discovering a profound Christian faith, A Year with C.S. Lewis offers unflinchingly honest insight for each day of the year."
11,9780060580865,"The Frog and Toad Collection Box Set (Includes 3 Favorite Frog and Toad Stories!)",14.99,3.34081,1,1,2004,855233,"Three beloved Frog and Toad books in a paperback slipcase"
12,9780060745929,"I Stink! Board Book",7.99,2.45082,4,2,2005,770322,"For fans of Goodnight, Goodnight, Construction Site and Steam Train, Dream Train comes a noisy addition to the hilarious read-aloud series from Kate and Jim McMullan, the popular creators of I’m Bad! and I’m Dirty! Now a streaming animated series!"
13,9780060853976,"Good Omens (The Nice and Accurate Prophecies of Agnes Nutter, Witch)",17.99,3.72166,3,1,2007,522162,"The classic collaboration from the international bestselling authors, now available in a keepsake hardcover edition. . . . “The Apocalypse has never been funnier.”—Clive Barker

Readers around the world have embraced the brilliance of Neil Gaiman and Terry Pratchett. Now, 15 years after it was first published, their classic comic novel of the endtimes—the only collaborative effort of these two masters—is available in a special collector’s edition sure to attract the attention of devoted fans and new readers alike."
14,9780060855888,"The Light Fantastic (A Discworld Novel)",15.99,3.52227,3,2,2005,317834,"Terry Pratchett's profoundly irreverent, bestselling novels have garnered him a revered position in the halls of parody next to the likes of Mark Twain, Kurt Vonnegut, Douglas Adams, and Carl Hiaasen."
15,9780060871253,"Seekers #2: Great Bear Lake",16.99,2.0246,4,3,2009,227683,"The second book in a thrilling animal fantasy series following the epic journey of three bears, from the #1 nationally bestselling author of Warriors."
16,9780061170812,"Mac and Cheese",4.99,1.47374,1,3,2010,486408,"Written in the style of P. D. Eastman’s classic Big Dog . . . Little Dog, this modern-day alley-cat odd couple will delight beginning readers."
17,9780380810123,"Johnny Hangtime",5.99,2.54853,4,3,2008,609071,"It's a bird, It's a plane--no, It's Johnny Hangtime!"
18,9780061688652,"Warriors Manga: Ravenpaw's Path #1: Shattered Peace",6.99,3.93664,4,2,2009,867634,"A graphic novel adventure from the world of Erin Hunter’s #1 nationally bestselling Warriors series!"
19,9780062094964,"Amelia Bedelia Chapter Book #1: Amelia Bedelia Means Business",5.99,3.46401,1,3,2013,7498,"Amelia Bedelia makes her chapter book debut! In Amelia Bedelia Means Business, a New York Times bestseller and the first book in the new chapter book series, young Amelia Bedelia will do almost anything for a shiny new bicycle."
20,9780062095060,"Amelia Bedelia Chapter Book #4: Amelia Bedelia Goes Wild!",5.99,1.02149,1,3,2014,759910,"Amelia Bedelia, America's favorite housekeeper, had a childhood full of surprises, mischief, and hilarious misunderstandings. In this illustrated chapter book adventure, just right for fans of Judy Moody and Ivy + Bean, young Amelia Bedelia and her friends build a zoo in the backyard (complete with stuffed animals and attractions) and offer safari adventures to the entire neighborhood. This is the fourth book in the nationally bestselling Amelia Bedelia chapter book series, and it is just right for newly independent readers ready for a more challenging vocabulary and books with chapters."
21,9780062218865,"Snuff (A Novel of Discworld)",9.99,3.70627,3,1,2012,408471,"At long last, Lady Sybil has lured her husband, Sam Vimes, on a well-deserved holiday away from the crime and grime of Ankh-Morpork. But for the commander of the City Watch, a vacation in the country is anything but relaxing. The balls, the teas, the muck—not to mention all that fresh air and birdsong—are more than a bit taxing on a cynical city-born and -bred copper."
22,9780062237378,"Small Gods (A Novel of Discworld)",9.99,4.03669,3,3,2013,673255,"Lost in the chill deeps of space between the galaxies, it sails on forever, a flat, circular world carried on the back of a giant turtle—"
23,9780062270306,"Twelve Recipes",27.99,2.53429,16,1,2014,642701,"Winner of the 2015 International Association of Culinary Professionals (IACP) Cookbook Award"
24,9780062272157,"The Eighth Day",16.99,4.95822,4,2,2014,686672,"Fans of Percy Jackson will devour this first book in Dianne K. Salerni's time-bending series that combines exciting magic and pulse-pounding suspense. In this riveting fantasy adventure, thirteen-year-old Jax Aubrey discovers a secret eighth day with roots tracing back to Arthurian legend."
25,9780061564901,"Paula (A Memoir)",16.99,4.33314,5,2,2013,209356,"When Isabel Allende's daughter, Paula, became gravely ill and fell into a coma, the author began to write the story of her family for her unconscious child. In the telling, bizarre ancestors appear before our eyes; we hear both delightful and bitter childhood memories, amazing anecdotes of youthful years, and the most intimate secrets passed along in whispers. With Paula, Allende has written a powerful autobiography whose straightforward acceptance of the magical and spiritual worlds will remind readers of her first book, The House of the Spirits."
26,9780062281753,"The December Project (An Extraordinary Rabbi and a Skeptical Seeker Confront Life's Greatest Mystery)",14.99,4.06271,11,3,2015,437801,"A Jewish Book Award Finalist"
27,9780062283597,"Big Nate: In a Class by Himself",7.99,2.44976,1,3,2015,504989,"“Big Nate is funny, big time.”--Jeff Kinney, author of Diary of a Wimpy Kid"
28,9780062287045,"Pretty Little Liars #16: Vicious",17.99,2.87104,6,3,2014,404972,"#1 New York Times bestselling series"
29,9780062294401,"The First Phone Call from Heaven (A Novel)",16.99,2.68833,3,3,2014,796691,"""What if the end is not the end?"""
30,9780062365750,"Lost River (A Cooper & Fry Mystery)",11.99,2.79549,3,3,2014,730865,"This atmospheric thriller is perfect for fans of Ian Rankin and Peter Robinson"
31,9780062297969,"Did God Kill Jesus? (Searching for Love in History's Most Famous Execution)",26.99,4.73382,8,2,2015,708525,"The popular Patheos blogger wants to restore the cross as primarily a symbol of God’s overwhelming love for us and to rescue Christians from the shame and guilt from seeing our situation as “sinners in the hands of an angry God,” which was an invention of the medieval church and became enshrined as orthodox Christianity."
32,9780062317384,"The Orphan Queen",17.99,2.37628,6,2,2015,928251,"An epic fantasy filled with adventure, intrigue, and romance from the New York Times bestselling coauthor of My Plain Jane, perfect for fans of Graceling by Kristin Cashore, The Girl of Fire and Thorns by Rae Carson, and Shadow and Bone by Leigh Bardugo."
33,9780062317605,"Bone Gap",17.99,2.51126,20,1,2015,201868,"National Book Award Finalist * Printz Award Winner for Best Young Adult Book of the Year"
34,9780062325310,"Savage Harvest (A Tale of Cannibals, Colonialism, and Michael Rockefeller's Tragic Quest for Primitive Art)",18.99,2.12664,21,1,2014,218305,"The mysterious disappearance of Michael Rockefeller in remote New Guinea in 1961 has kept the world, and even Michael's powerful, influential family, guessing for years. Now, Carl Hoffman uncovers startling new evidence that finally tells the full, astonishing story."
35,9780062332585,"Endgame: The Calling",19.99,3.19426,6,3,2014,376838,"The New York Times bestseller and international multimedia phenomenon!"
36,9780062334824,"It Started with a Scandal (Pennyroyal Green Series)",7.99,2.05454,3,3,2015,718674,"Lord Philippe Lavay once took to the high seas armed with charm as lethal as his sword, and a stone-cold conviction: he'll restore his family's fortune and honor, no matter the cost. Victory is at last within reach—when a brutal attack snatches it from his grasp and lands him in Pennyroyal Green."
37,9780062337702,"The Promise of Palm Grove (Amish Brides of Pinecraft, Book One)",12.99,2.70374,3,3,2015,765618,"A young Amish woman finds herself torn between the man she’s pledged to wed and the man her heart desires in this heartwarming story of chance, duty, and choice in the face of love—the first volume in the beloved New York Times bestselling author’s new Amish Brides of Pinecraft series."
38,9780060916701,"The Fires of Jubilee (Nat Turner's Fierce Rebellion)",13.99,1.3744,9,1,2014,483740,"The bloody slave rebellion led by Nat Turner in Virginia in 1831 and the savage reprisals that followed shattered beyond repair the myth of the contented slave and the benign master, and intensified the forces of change that would plunge America into the bloodbath of the Civil War."
39,9780062348807,"The Tell-Tale Heart (A Novel)",14.99,1.86917,3,3,2015,758105,"A man’s life and his capacity for love mysteriously changes after a heart transplant in this dramatic and affecting novel—as provocative and poignant as the works of Jodi Picoult, Jojo Moyes, and Alice Sebold—from the acclaimed Orange Prize nominee and author of Lucky Bunny."
40,9780062353412,"Make It Count (A Bowler University Novel)",6.99,1.22139,3,2,2014,847951,"Kat Caruso wishes her brain had a return policy, or at least a complaint hotline. The defective organ is constantly distracted, terrible at statistics, and absolutely flooded with inappropriate thoughts about her boyfriend's gorgeous best friend, Alec . . . who just so happens to be her brand-new math tutor. Who knew nerds could be so hot?"
41,9780062369062,"Chase Me (A Broke and Beautiful Novel)",6.99,2.73586,3,2,2015,546023,"Winner of the RT Book Reviews March Seal of Excellence Award"
42,9780062370365,"The Bookseller (A Novel) - 9780062370365",25.99,2.58308,3,3,2015,741290,"A provocative and hauntingly powerful debut novel reminiscent of Sliding Doors, The Bookseller follows a woman in the 1960s who must reconcile her reality with the tantalizing alternate world of her dreams."
43,9780062380494,"The Elusive Lord Everhart (The Rakes of Fallow Hall Series)",8.99,3.30696,3,2,2015,446232,"Vivienne Lorret, the USA Today bestselling author of Winning Miss Wakefield, returns with a new series featuring the three roguish bachelors of Fallow Hall."
44,9780062392749,"One Mile Under (A Ty Hauck Novel) - 9780062392749",26.99,1.37197,3,3,2015,159159,"In New York Times bestselling author Andrew Gross's propulsive thriller, set amid the drought-stricken oil country of Colorado's beautiful high plains, Ty Hauck makes his long-awaited return rallying beaten-down farmers and ranchers against a giant energy company in a deadly confrontation involving murder, retaliation, and cover-up."
45,9780007155422,"Moondust (In Search of the Men Who Fell to Earth)",13.95,1.02217,9,1,2006,720975,"The Apollo lunar missions of the 1960s and 1970s have been called the last optimistic acts of the twentieth century. Twelve astronauts made this greatest of all journeys and were indelibly marked by it, for better or for worse. Journalist Andrew Smith tracks down the nine surviving members of this elite group to find their answers to the question ""Where do you go after you've been to the Moon?"""
46,9780007156122,"Man About Town (A Novel)",15.99,4.91991,3,1,2004,293391,"A congressional adviser and habitué of a cozy circuit of bars inside the Beltway, Joel Lingeman never quite felt middle-aged. At least not until he was abandoned by his partner of fifteen years and suddenly thrust into a dating scene with men half his age and no discernible trace of love handles. But this unexpected hole in his life inspires Joel's search for a 1964 edition ofan Esquire-like magazine that contained a swimsuit ad that obsessed and haunted him throughout his youth. Determined to find out what happened to the model shown in the ad, Joel slowly begins to understand what has happened to his own life. Sexy, smart, and deftly observed, Man About Town is a new twist on the idea that the personal is political and a must read for anyone who's ever wondered what happened to that first crush."
47,9780007161324,"The Lucky Ones",15.99,4.48061,3,3,2005,443086,"A young pregnant mother wrestles with an utterly changed life; a new father searches for a sign of the man he used to be; a daughter yearns for a lost childhood; and a mother reaches out in bewilderment to a child she can't fully understand. A rare novel that illuminates ""the bustling concourses of life"" without sacrificing emotional depth and complexity, The Lucky Ones confirms Rachel Cusk's place among our most incisive writers."
48,9780007163656,"Eating the Sun (How Plants Power the Planet)",15.99,2.27616,27,1,2009,288049,"This book title, Eating the Sun (How Plants Power the Planet), ISBN: 9780007163656, by Oliver Morton, published by HarperCollins (November 17, 2009) is available in paperback. Our minimum order quantity is 25 copies. All standard bulk book orders ship FREE in the continental USA and delivered in 4-10 business days."
49,9780007163670,"Politics (A Novel)",14.99,1.5627,3,1,2004,162821,"Politics is about: a) a threesome; b) politics"
50,9780007170609,"The Last Playboy (The High Life of Porfirio Rubirosa)",15.99,2.25243,5,2,2006,635064,"At one gilded moment in history, his fame was so great that he was known the world over by his nickname alone: Rubi. Pop songs were written about him. Women whom he had never met offered to leave their husbands for him. He had an eye for feminine beauty, particularly when it came with great wealth: Barbara Hutton, Doris Duke, Eva Perón, and Zsa Zsa Gabor. But he was a man's man as well, polo player and race-car driver, chumming around with the likes of Joe Kennedy, Frank Sinatra, Oleg Cassini, Aly Khan, and King Farouk. He was also a jewel thief, and an intimate of one of the world's most bloodthirsty dictators. And when he died at the age of fifty-six—wrapping his sports car around a tree in the Bois de Boulogne—a glamorous era of white dinner jackets at El Morocco and celebrity for its own sake died along with him."
51,9780060000028,"Warriors #1: Into the Wild",16.99,4.97617,4,3,2003,498258,"Epic adventures. Fierce warrior cats. A thrilling fantasy world. It all begins here."
52,9780060000035,"Warriors #2: Fire and Ice",16.99,4.63794,4,2,2003,832072,"The second book in Erin Hunter’s #1 nationally bestselling Warriors series"
53,9780060000042,"Warriors #3: Forest of Secrets",16.99,1.68034,4,3,2003,718838,"The third book in Erin Hunter’s #1 nationally bestselling Warriors series"
54,9780060000059,"Warriors #4: Rising Storm",16.99,3.41606,4,3,2004,770842,"The fourth book in Erin Hunter’s #1 nationally bestselling Warriors series"
55,9780060000066,"Warriors #5: A Dangerous Path",16.99,4.8272,4,1,2004,679860,"The fifth book in Erin Hunter’s #1 nationally bestselling Warriors series"
56,9780060000073,"Warriors #6: The Darkest Hour",17.99,3.82527,4,1,2004,469292,"The sixth book in Erin Hunter’s #1 nationally bestselling Warriors series"
57,9780060000189,"Hurricane (A Novel)",16.99,2.04003,4,1,2008,723206,"The powerful story of a boy's fear and courage in the face of a force of nature too huge to even imagine."
58,9780060000806,"The Treasure of Montsegur (A Novel of the Cathars)",14.99,1.92967,3,3,2003,189237,"One woman's unforgettable quest for freedom, love, and god."
59,9780060001049,"Bad Boys",7.99,1.06585,4,2,2006,325400,"Wally and Willy are on the lam again. But as Willimina and Wallanda, they're free and clear . . . or are they? These cleverly disguised wolves think they can fool an entire flock with their womanly wool-wear, but three savvy sheep expose their plan. It looks like another close shave for these baa-aad boys!"
60,9780060001100,"The Perfect Pet",7.99,2.68066,1,1,2009,959150,"A funny book to share with kids who really, really, REALLY want a pet!"
61,9780060001209,"3 Little Firefighters",6.99,1.21272,4,2,2003,426990,"We're missing all our buttons! Three firefighters scramble to find 3 sets of matching buttons before the big parade starts. A lively introduction to the simple math concept of sorting by attributes."
62,9780060001230,"100 Days of Cool",6.99,1.00856,29,3,2003,582543,"Stuart J. Murphy travels all over the United States talking to thousands of kids. And you'll never believe what they talk about: MATH! Stuart shows kids that they use math every day -- to share a pizza, spend their allowance, and even sort socks. Stuart writes funny stories about math -- and if you read his books, you'll start to see the fun in math, too."
63,9780060001278,"Earth Day--Hooray!",17.99,3.37174,4,2,2004,147381,"Earth Day is on the way, and Ryan, Luke, and Carly have a plan. If they manage to collect and recycle 5,000 aluminum cans, they can make enough money to buy some beautiful flowers for nearby Gilroy Park."
64,9780060001322,"Leaping Lizards",6.99,4.05567,1,2,2005,149594,"Stuart J. Murphy travels all over the UnitedStates talking to thousands of kids. And you'll never believe what they talk about: MATH! Stuart shows kids that they use math every day -- to share a pizza, spend their allowance, even sort socks. Stuart writes funny stories about math -- and if you read his books, you'll start to see the fun in math, too."
65,9780060001445,"Her Highness, My Wife",7.99,4.43386,3,3,2002,996722,"Women never said no to the dashing Lord Matthew Weston and he never said no to them. But this was the first time he found one tempting enough to impetuously say ""I do."" Was it any wonder he awoke to discover her gone? And when Matthew learned the enchanting creature he'd married was of royal blood -- and would abandon their marriage bed without a second thought -- he vowed to put her out of his life forever."
66,9780060001452,"Love With the Proper Husband",8.99,2.93941,3,2,2003,561230,"Distressed over the current widespread disinterest inmatrimony among their eminently marriageable offspring, the formidable matriarchs of the ton have taken matters into their own meddling hands with the formation of The Ladies' Society for the Betterment of the Future of Britain. Their first challenge: the Earl of Pennington."
67,9780060001506,"Diary of a Worm",17.99,4.18888,1,2,2003,507071,"#1 New York Times Bestseller!"
68,9780060001537,"Diary of a Spider",17.99,1.39541,1,3,2005,261992,"#1 New York Times Bestseller!"
69,9780060001568,"Diary of a Fly",16.99,1.08404,4,2,2007,221644,"This is the diary...of a fly. A fly who, when she's not landing on your head or swimming in your soup, is trying to escape her 327 brothers and sisters who are driving her crazy!"
70,9780060002077,"A Gentleman's Honor",8.99,3.81435,3,1,2003,303715,"The Season has yet to begin, and the second member of the Bastion Club, tall, handsome Anthony Blake, Viscount Torrington, is already a target for every matchmaking mama in London. None of their flighty daughters can fix his interest, but a certain lady does..."
71,9780060002107,"Ignorance (A Novel)",15.99,2.96579,3,1,2003,398440,"A New York Times Notable Book"
72,9780060002244,"Wallace's Lists",16.99,2.93009,4,2,2004,526578,"Wallace, a mouse, could do almost anything. Anything that is, as long as he had a list."
73,9780060004330,"Raising Blaze (A Mother and Son's Long, Strange Journey into Autism)",15.99,3.8451,14,1,2003,363185,"When you have a child that doesn't fit in, what do you do? Debra Ginsberg knew that her son, Blaze, was unique from the moment he was born in 1987. What she didn't know was that Blaze's differences would be regarded by the outside world not as gifts, but as impediments to social and academic success. Blaze never crawled. He just got up and walked when he turned one. He called his mother 'Zsa Zsa' until he was three. By kindergarten, he loved the music of Miles Davis and Ella Fitzgerald. He fears butterflies and is fascinated by garbage trucks. With the same honesty that made Waiting a success, Raising Blaze: Bringing Up an Extraordinary Son in an Ordinary World chronicles Debra's experience in raising a child who has defied definition by the host of professionals who have sought to label his differences. Ginsberg introduces us to a remarkable child and her own unusual childhood. She writes about a family which shows us the redemptive power of faith, humour and love."
74,9780060004408,"A People's History of the American Revolution (How Common People Shaped the Fight for Independence)",13.99,3.03821,21,3,2002,383475,"A sweeping narrative of the wartime experience, A People's History of the American Revolution is the first book to view the revolution through the eyes of common folk. Their stories have long been overlooked in the mythic telling of America's founding, but are crucial to a comprehensive understanding of the fight for independence. Now, the experiences of farmers, laborers, rank and file soldiers, women, Native Americans, and African Americans -- found in diaries, letters, memoirs and other long-ignored primary sources -- create a gritty account of rebellion, filled with ideals and outrage, loss, sacrifice, and sometimes scurrilous acts...but always ringing with truth."
