145,9780060088835,"Quick Loaves (150 Breads and Cakes, Meat and Meatless Loaves)",17.99,4.07421,16,2,2005,484646,"Easy does it! That's the mantra of today's busy cook. And what could be easier than quick loaves -- no-fuss, no-muss starters, main dishes, sides, breads, and desserts?"
146,9780060088897,"Heaven's My Destination (A Novel)",14.99,1.14,3,3,2003,216336,"Drawing on such unique sources as the author's unpublished letters, business records, and obscure family recollections, Tappan Wilder's Afterword adds a special dimension to the reissue of this hilarious tale about goodness in a fallen world."
147,9780060088903,"The Ides of March (A Novel)",14.99,3.41706,3,3,2003,748096,"Drawing on such unique sources as Thornton Wilder's unpublished letters, journals, and selections from the extensive annotations Wilder made years later in the margins of the book, Tappan Wilder's Afterword adds a special dimension to the reissue of this internationally acclaimed novel."
148,9780060088927,"Theophilus North (A Novel)",15.99,2.11069,3,3,2003,748235,"Marking the thirtieth anniversary of Theophilus North, this beautiful new edition features Wilder's unpublished notes for the novel and other illuminating documentary material, all of which is included in a new Afterword by Tappan Wilder."
149,9780060088934,"The Skin of Our Teeth (A Play)",14.99,4.74947,3,2,2003,400312,"A timeless statement about human foibles . . . and human endurance, this beautiful new edition features Wilder's unpublished production notes, diary entries, and other illuminating documentary material, all of which is included in a new Afterword by Tappan Wilder."
150,9780060088958,"The Dark Bride (A Novel)",16.99,4.29215,3,1,2003,206209,"Once a month, the refinery workers of the Tropical Oil Company descend upon Tora, a city in the Colombian forest. They journey down from the mountains searching for earthly bliss and hoping to encounter Sayonara, the legendary Indian prostitute who rules their squalid paradise like a queen. Beautiful, exotic, and mysterious, Sayonara, the undisputed barrio angel, captivates whoever crosses her path. Then, one day, she violates the unwritten rules of her profession and falls in love with a man she can never have. Sayonara's unrequited passion has tragic consequences not only for her, but for all those whose lives ultimately depend on the Tropical Oil Company."
151,9780060089085,"Little Bo in Italy (The Continued Adventures of Bonnie Boadicea)",19.99,3.66404,4,1,2010,53223,"Little Bo's sailor friend, Billy, has signed on aboard Lord and Lady Goodlad's handsome yacht, Legend. Bo is delighted, for now she and Billy can see more of the world, and she can continue her quest to find news of her long-lost brothers and sisters. Bo is determined to make sure they have all found safe and happy homes—even if it takes a lifetime of travels."
152,9780060089672,"Space Cat",4.99,3.55399,4,3,2006,236376,"Space Cat and his trusty robot, Earl, are forced to land their rocket on a strange planet. Space Cat has to find more fuel to get home. Will he ever blastoff again?"
153,9780060090067,"Tree Girl",10.99,4.80198,1,3,2005,876976,"They call Gabriela Tree Girl. Gabi climbs trees to be within reach of the eagles and watch the sun rise into an empty sky. She is at home among the outstretched branches of the Guatemalan forests."
154,9780060090074,"Ghost of Spirit Bear",16.99,1.12804,4,1,2008,413538,"In award-winning author Ben Mikaelsen’s riveting sequel to the acclaimed word-of-mouth bestseller Touching Spirit Bear, readers will be captivated by what Booklist calls a “hugely satisfying resolution.”"
155,9780060090241,"Bodies and Souls (The Tragic Plight of Three Jewish Women Forced into Prostitution in the Americas)",14.99,4.25016,8,2,2006,318100,"In the second half of the nineteenth century, several thousand impoverished young Jewish women from Eastern Europe were forced into prostitution in the frontier colonies of Latin America, South Africa, India, and parts of the United States by the Zwi Migdal, a notorious criminal gang of Jewish mobsters."
156,9780060090630,"The Schooling of Claybird Catts (A Novel)",15.99,2.3047,3,3,2004,939246,"To be perfectly honest, the day my father died really wasn't the worst day of my life."
157,9780060090654,"Birth of the Chess Queen (A History)",17.99,2.11535,9,1,2005,206891,"Everyone knows that the queen is the most dominant piece in chess, but few people know that the game existed for five hundred years without her. It wasn't until chess became a popular pastime for European royals during the Middle Ages that the queen was born and was gradually empowered to become the king's fierce warrior and protector."
158,9780060091071,"El gran granero rojo (Big Red Barn Board Book (Spanish edition))",7.99,1.53031,1,3,2003,797222,"This high-quality Spanish-language book can be enjoyed by fluent Spanish speakers as well as those learning the language, whether at home or in a classroom."
159,9780060091101,"A Drop of Blood",5.99,2.86668,1,2,2004,211180,"You've seen your own blood, when you have a cut or a scrape. You can see the veins in your wrist, and you've seen the scab that forms as a cut heals. But do you know what blood does for you? Without blood, you couldn't play, or grow, or learn. That's because just about every part of your body needs blood, from your muscles to your bones to your brain. How does your body use blood? Read and find out!"
160,9780060092634,"Fiesta! Board Book (Bilingual Spanish-English)",7.99,4.68436,1,1,2003,413452,"Horns, airplanes, and tops. Whistles, gum, and rings."
161,9780060092641,"My Favorite Bride (Governess Brides #7)",7.99,4.99355,3,1,2002,881830,"When Miss Samantha Prendregast arrives at Devil's Fell to take charge of six rebellious girls, the vibrant, outspoken governess is not quite prepared to deal with the tall, dark and dashing master of the grand estate. The children she can manage with intelligence, guile . . . and a little bribery. Their widowed father, Colonel William Gregory, is not so easily charmed -- and far too easy to fall in love with, which she dares not do."
162,9780060092665,"One Kiss From You (Switching Places #2)",8.99,1.325,3,2,2003,651254,"A bold woman known as the ""duchess of Magnus"" was wagered—and won—in a card game. But the woman who arrived was her shy, quiet cousin Eleanor."
163,9780060092719,"If You'll Be My Valentine",7.99,1.18962,4,2,2005,729334,"IF YOU'LL BE MY VALENTINE"
164,9780060092863,"I Love School!",7.99,3.80454,4,1,2006,144901,"What's your favorite part of the school day?"
165,9780060092900,"I'm Mighty!",17.99,1.26853,4,2,2003,278384,"From Kate and Jim McMullan, the popular creators of I Stink! and I’m Dirty!—now a streaming animated series—comes a raucous tribute to a tireless harbor hero. This time a tugboat proves that even the smallest of us can be MIGHTY!"
166,9780060092979,"The Seduction of an English Lady",8.99,1.04201,3,1,2003,467876,"To seduce an English lady, a gentleman must always remember to . . ."
167,9780060093341,"Vampire Kisses",17.99,3.3348,6,2,2003,882102,"In her small town, dubbed ""Dullsville,"" sixteen-year-old Raven -- a vampire-crazed goth-girl -- is an outcast. But not for long..."
168,9780060093600,"The Conquest",15.99,4.96812,3,3,2003,18832,"Sara Rosario Gonzáles is a restorer of rare books and manuscripts at the Getty Museum in Los Angeles. When Sara restores a sixteenth-century manuscript about an Aztec princess enslaved by Cortés and sent to Europe to entertain the pope and Emperor Charles V, she doesn't realize the power of the tale she's about to immerse herself into."
169,9780060093747,"The Art of the Novel",14.99,1.15295,30,2,2003,114386,"Kundera brilliantly examines the work of such important and diverse figures as Rabelais, Cervantes, Sterne, Diderot, Flaubert, Tolstoy, and Musil. He is especially penetrating on Hermann Broch, and his exploration of the world of Kafka's novels vividly reveals the comic terror of Kafka's bureaucratized universe."
170,9780060094447,"Thanksgiving Night (A Novel)",15.99,1.68631,3,2,2007,927727,"Will Butterfield can't believe it. His 75–year–old mother, Holly, is drunk and threatening to jump off the roof. Again."
171,9780060094546,"Biscuit Loves School Giant Lift-the-Flap",9.99,3.21524,4,1,2003,123347,"He is a curious little puppy. Lift the flaps to join Biscuit as he spends the day playing, learning, and exploring."
172,9780060094553,"Biscuit Wins a Prize",16.99,2.42716,4,3,2003,107679,"It's the day of the pet show, and Biscuit has to look his best. All his old friends are at the show, and he sees so many new friends that he can't sit still -- even for the judge!"
173,9780060094560,"I'll Find a Way or Make One (A Tribute to Historically Black Colleges and Universities)",20.95,2.95993,15,3,2007,300576,"A comprehensive and definitive guide to America's 107 historically black colleges and universities, this commemorative gift book explores the historical, social, and cultural importance of the nation's HBCUs and celebrates their rich legacy."
174,9780060094591,"Biscuit and the Baby",16.99,3.19138,4,1,2005,448625,"For fans of Clifford and Spot, welcome everybody’s favorite little yellow puppy, Biscuit, in an I Can Read adventure!"
175,9780060094621,"Biscuit Loves Mother's Day",6.99,4.4948,4,2,2004,943206,"Let's celebrate Mother's Day, Biscuit!"
176,9780060094638,"Biscuit Loves Father's Day",6.99,2.87161,4,2,2004,361301,"Father's Day is a great time to show Dad how much we love him. Unfold the big flaps and join Biscuit for fun times with Dad -- exploring, playing, and sharing."
177,9780060094669,"Biscuit Visits the Pumpkin Patch",4.99,3.82337,1,2,2004,782448,"Get in the spooky spirit and join Biscuit on an adventure to find the perfect pumpkin in this Halloween board book!"
178,9780060094676,"Biscuit Gives a Gift",4.99,3.39528,1,1,2004,792671,"Christmas is a wonderful time for sharing. Biscuit finds the perfect gifts foreveryone he loves."
179,9780060094683,"Biscuit's Snowy Day",4.99,1.50198,1,1,2005,133699,"Biscuit loves playing in the snow!"
180,9780060094690,"Biscuit's Hanukkah",4.99,3.11476,4,1,2005,669483,"Come along wit Biscuit as he makes a beautiful menorah to celebrate Hanukkah. It's a great time for stories, songs, food and friends!"
181,9780060094706,"Biscuit's Pet & Play Christmas (A Touch & Feel Book)",7.99,4.8249,1,3,2006,804791,"Cozy up for Christmas fun with Biscuit, everyone's favorite little yellow puppy!"
182,9780060094898,"Staying Fat for Sarah Byrnes",9.99,3.86827,6,3,2003,463865,"Called a “masterpiece” in a starred review from School Library Journal, award-winning author Chris Crutcher’s acclaimed Staying Fat for Sarah Byrnes is an enduring classic."
183,9780060094904,"The Crazy Horse Electric Game",10.99,4.58137,6,1,2003,83762,"Willie is a top athlete, the star of the legendary game against Crazy Horse Electric. Then a freak accident robs him of his once-amazing physical talents."
184,9780060094911,"Running Loose",9.99,4.59925,6,3,2003,129934,"He's got a starting spot on the football team, good friends, and a smart, beautiful girlfriend who loves him as much as he loves her."
185,9780060094935,"The Bromeliad Trilogy (Truckers, Diggers, and Wings)",19.99,4.48902,4,2,2003,697703,"In a world whose seasons are defined by Christmas sales and Spring Fashions, hundreds of tiny nomes live in the corners and crannies of a human-run department store. They have made their homes beneath the floorboards for generations and no longer remember -- or even believe in -- life beyond the Store walls."
186,9780060095284,"Fire Lover",8.99,1.96153,40,2,2003,17590,"On an October evening in South Pasadena, a horrifying wave of flame swept through a large home improvement center, snuffing out the lives of four innocent people, including a two-year-old boy. Firefighters rushed to the scene, even as a pair of equally suspicious fires broke out in two nearby stores. Silently watching the raging inferno in the midst of the heat, smoke, and chaos was a man respected as one of California's foremost arson investigators, a captain in the Glendale Fire Department ..."
187,9780060099459,"Merry Christmas, Amelia Bedelia",4.99,2.01372,1,3,2002,410847,"It's Christmas Eve, and Amelia Bedelia has to get the Rogers house ready for a visit from Aunt Myra. But with Amelia Bedelia in charge, this Christmas will be one of the funniest ever!"
188,9780060207489,"Big Red Barn",17.99,4.13991,1,1,1989,425278,"Margaret Wise Brown's simple, rhythmic text about the cycle of a day on a farm, where a family of animals peacefully plays and sleeps, has charmed generations of children."
189,9780060207502,"Big Red Barn Big Book",24.99,4.70967,1,2,1991,263339,"Margaret Wise Brown's simple, rhythmic text about the cycle of a day on a farm, where a family of animals peacefully plays and sleeps, has charmed generations of children. This big book edition (15 x 17 3/4"") is perfect for sharing in classrooms."
190,9780060236298,"Morning, Noon, and Night",17.89,1.03677,21,3,1999,335162,"Celebrate the cycle of the day, as the earth turnes to and then away from the sun, and meet a wide array of animals from America's east coast to the west as they work and rest, eat and play, just as humans do."
191,9780060239411,"Mouse Tales",16.99,3.51476,4,3,1972,465369,"When Papa's seven little mouse boys ask for a bedtime story, Papa does even better than that—he tells seven stories, one for each boy!"
192,9780060239503,"Frog and Toad All Year",16.99,2.3317,1,3,1976,334858,"In winter, spring, summer, and fall, Frog and Toad are always together. From sledding in winter to eating ice cream on hot summer days, these two friends have fun the whole year round!"
193,9780060239671,"Mouse Soup",16.99,1.557,4,3,1997,180811,"Weasel is ready for his dinner, and poor Mouse is it. Can Mouse stop Weasel from serving up mouse soup for supper? The clever mouse tells the weasel four stories to make the soup tasty—then manages to trick the weasel and get home safely. This Level Two I Can Read is geared toward kids who read on their own but still need a little help."
194,9780060239732,"Fables",17.99,2.16545,4,2,1980,17350,"Winner of the Caldecott Medal"
195,9780060242305,"Father Bear Comes Home",16.95,1.60746,4,1,1959,822788,"The children, parents, teachers, and librarians who so joyously welcomed Little Bear, the first I Can Read Book by this author and artist, will greet the return of these favorite characters with true delight."
196,9780060242558,"Little Bear's Friend",16.95,2.36985,4,2,1960,794380,"This is the third book about Little Bear. All his old friends are back—Owl, Cat, Duck, and Hen—and a new friend has come for the summer—a little girl named Emily. Emily has her doll, Lucy, with her, and she promptly introduces Lucy to Little Bear. The three get along wonderfully, and when summer ends, Emily finds the perfect parting gift for her friend."
197,9780060242657,"Little Bear's Visit",16.95,2.07997,4,3,1961,209561,"Little Bear and his parents are familiar to almost all beginning readers. And now beginning readers meet Grandmother and Grandfather Bear, whom they are sure to love as much as Little Bear does."
198,9780060242985,"A Kiss for Little Bear",16.99,1.45049,4,3,1968,587647,"Little Bear is so pleased with the picture he has drawn that he asks Hen to take it to his grandmother. Grandmother is so happy with it that she sends him back a thank-you kiss."
199,9780060255237,"Outside Over There",22.95,1.31776,4,1,1981,844675,"This book title, Outside Over There, ISBN: 9780060255237, by Maurice Sendak, Maurice Sendak, published by HarperCollins (April 22, 1981) is available in hardcover. Our minimum order quantity is 25 copies. All standard bulk book orders ship FREE in the continental USA and delivered in 4-10 business days."
200,9780060255305,"Alligators All Around",16.89,1.27083,4,3,1962,699083,"An alligator jamboree, with all the letters—A through Z."
201,9780060255350,"Chicken Soup with Rice (A Book of Months)",16.89,2.49788,4,3,1962,275498,"Maurice Sendak, the Caldecott Medal-winning creator of the iconic Where the Wild Things Are, created a warmly loved classic book of months, in verse, with Chicken Soup with Rice."
202,9780060259655,"Pierre (A Cautionary Tale)",16.89,4.11398,4,1,1962,158833,"This book title, Pierre (A Cautionary Tale), ISBN: 9780060259655, by Maurice Sendak, Maurice Sendak, published by HarperCollins (November 28, 1962) is available in hardcover. Our minimum order quantity is 25 copies. All standard bulk book orders ship FREE in the continental USA and delivered in 4-10 business days."
203,9780060279387,"Bathtime for Biscuit",17.89,4.97379,4,1,1998,696017,"For fans of Clifford and Spot, welcome everybody’s favorite little yellow puppy, Biscuit, in an I Can Read adventure!"
204,9780060281892,"The Little Fir Tree",15.99,1.27311,4,2,2005,583022,"They put golden tinsel on his branches
And golden bells
And green icicles
And silver stars
And red and green and blue and purple chains of shining Christmas balls."
205,9780060283162,"Si le das un panqueque a una cerdita (If You Give a Pig a Pancake (Spanish edition))",16.99,4.95377,4,3,1999,632900,"This high-quality Spanish-language book can be enjoyed by fluent Spanish speakers as well as those learning the language, whether at home or in a classroom."
206,9780060283247,"If You Give a Cat a Cupcake",17.99,3.27317,4,1,2008,544603,"The lovable cat who first appeared in If You Give a Pig a Party now has his very own book in the beloved #1 New York Times bestselling If You Give... series!"
207,9780060283261,"If You Give a Pig a Party",17.99,3.86249,4,3,2005,434043,"The little pig from If You Give a Pig a Pancake is back in this picture book in the beloved #1 New York Times bestselling If You Give... series!"
208,9780060283285,"If You Take a Mouse to School",18.99,3.29929,4,1,2002,958155,"Mouse goes to school in this picture book in the beloved #1 New York Times bestselling If You Give... series!"
209,9780060283551,"Happy Birthday, Biscuit!",16.99,2.59688,4,3,1999,279985,"Surprise!"
210,9780060283735,"The Squeaky Door",17.99,3.06109,4,2,2006,252254,"THE SQUEAKY DOOR"
211,9780060283766,"Two Little Trains",17.99,3.00545,4,2,2001,565901,"From two-time Caldecott Medal-winning artists Leo and Diane Dillon and beloved children’s book author Margaret Wise Brown comes Two Little Trains."
212,9780060283841,"Roar! (A Noisy Counting Book)",17.99,3.96798,4,1,2000,873079,"Roars the little lion cub."
213,9780060284176,"I Gotta Draw",16.99,4.63273,4,1,2012,381329,"Charlie Muttnik is the pup with the pencil, the mutt with the marker, the dog with the drawing pad, the chap with the chalk! He draws all the time."
214,9780060284480,"Wiggling Worms at Work",16.99,2.5034,24,1,2003,586328,"Deep underground and on the surface, worms are hard at work! Worms work like little plows, burrowing through soil by swallowing it. As they make their way through the dirt, worms loosen the soil so roots can spread and grow. Worms eat the bits of leaves and plants mixed with the dirt and leave behind castings that feed the plants. Find out how worms help us as they wiggle their way underground."
215,9780060284510,"The Giving Tree Slipcase Mini Edition",17.99,3.67025,1,2,1999,765054,"""Once there was a tree ... and she loved a little boy."" So begins a story of unforgettable perception, beautifully written and illustrated by the gifted and versatile Shel Silverstein. This miniature full-cloth, gold-stamped edition is a beautiful gift, suitable for such occasions as graduation."
216,9780060284596,"I'll Be You and You Be Me",16.99,3.52752,21,2,2001,30698,"From the team that brought us A Hole Is To Dig, here's another romp through the wild and wonderful imagination of children."
217,9780060284602,"The Moon Jumpers",17.95,1.89187,4,2,2013,749463,"Four years before Where the Wild Things Are won the Caldecott Medal, Maurice Sendak produced some of his most spectacular artwork for The Moon Jumpers. Printing technology has greatly improved since this enchanting picture book was first released more than fifty years ago, and now, with new color separations, the reproduction of Maurice Sendak's artwork comes closer to his stunning originals than ever before. Sendak's wondrous starry skies and Janice May Udry's evocative text immediately transport us back to cool, moonlit nights and fill us with the universal warmth of childhood. The Moon Jumpers' timeless beauty and inspiration earned it a Caldecott Honor in 1960 and will surely gather a new generation of fans."
218,9780060284626,"How Little Lori Visited Times Square",16.95,1.68839,4,1,2001,273205,"This book title, How Little Lori Visited Times Square, ISBN: 9780060284626, by Amos Vogel, Maurice Sendak, published by HarperCollins (May 22, 2001) is available in hardcover. Our minimum order quantity is 25 copies. All standard bulk book orders ship FREE in the continental USA and delivered in 4-10 business days."
219,9780060284657,"Good Thing You're Not an Octopus!",17.99,2.87706,4,1,2001,222424,"If you were an octopus, you would have eight legs to put into your pants!"
220,9780060284770,"Zlateh the Goat and Other Stories",18.99,4.41106,4,3,2001,901943,"Nobel laureate Isaac Bashevis Singer introduces readers to the village of Chelm in this Newbery Honor Book. Chelm is a village of fools. The most famous fools—the oldest and the greatest—are the seven Elders. But there are lesser fools too: a silly irresponsible bridegroom; four sisters who mix up their feed in bed one night; a young man who imagines himself dead. Here are seven magical folktales spun by a master storyteller, that speak of fools, devils, schlemiels, and even heroes—like Zlateh the goat."
221,9780060285456,"Sammy the Seal",16.99,2.98665,4,3,2000,916142,"Sammy, the adventurous seal, leaves the zoo for the day and ventures into the big, busy city. Along the way he finds a school full of kids and new things to do—and he even learns to read!"
222,9780060286224,"Incredible Me!",17.99,3.5358,4,3,2003,734885,"Join a rambunctious child as she exuberantly celebrates all the wonderful qualities that make her special -- her nose, her toes, her ears, herself!"
223,9780060286361,"Open House for Butterflies",15.95,1.27409,4,2,2001,660761,"This book title, Open House for Butterflies, ISBN: 9780060286361, by Ruth Krauss, Maurice Sendak, published by HarperCollins (December 4, 2001) is available in hardcover. Our minimum order quantity is 25 copies. All standard bulk book orders ship FREE in the continental USA and delivered in 4-10 business days."
224,9780060286408,"Charlotte and The White Horse",15.99,2.69506,4,2,2001,92975,"Continuing a two-year program to bring back twenty-two Maurice Sendak treasures long out of print, our second season of publication highlights one of the most successful author-illustrator pairings of all time. A pioneer of great children's literature, Ruth Krausspublished more than thirty books for children during a career that spanned forty years. Krauss and Sendak collaborated on eight books, and we are delighted to reintroduce four of these gems in brand-new editions, together with a favorite Maurice Sendak picture book."
225,9780060286422,"Hector Protector and As I Went Over the Water (Two Nursery Rhymes)",19.95,2.8494,4,1,2001,768334,"Maurice Sendak has interpreted these old' Mother Goose rhymes in animated sequences that have the aliveness and immediacy of a child's own imaginings."
226,9780060286828,"Biscuit Goes to School",16.99,4.3938,4,1,2002,34277,"Go back to school with Biscuit and share the love of reading with your beginner reader!"
227,9780060287238,"Chicken Said, ""Cluck!""",16.99,3.19789,4,2,2008,720774,"An ALA Theodor Seuss Geisel Honor Book"
228,9780060287672,"Does a Kangaroo Have a Mother, Too?",18.89,3.86297,4,1,2000,721669,"From Eric Carle, the New York Times bestselling author of The Very Hungry Caterpillar and The Grouchy Ladybug, comes a reassuring tale of a mother’s love for her child."
229,9780060287832,"Circus Girl",19.95,4.02489,4,2,2002,505721,"Fans of Maurice Sendak's Caldecott Medal-winning Where the Wild Things Are will love Circus Girl—a loving collaboration between Maurice Sendak and his brother, Jack Sendak."
230,9780060287931,"Galapagos George",15.99,3.53317,4,2,2014,702956,"This is the story of the famous Lonesome George, a giant tortoise who was the last of his species, lived to be one hundred years old, and became known as the rarest creature in the world. His story gives us a glimpse of the amazing creatures inhabiting the ever-fascinating Galápagos Islands."
231,9780060287955,"The Sign on Rosie's Door",16.95,3.04507,4,1,2002,210037,"Fans of Maurice Sendak's Caldecott Medal-winning Where the Wild Things Are will love The Sign on Rosie's Door—the book that inspired the Broadway musical Really Rosie, with music by Carole King!"
232,9780060288983,"I Love Planes!",16.99,4.86302,4,3,2003,534912,"What does your favorite plane do?"
233,9780060289003,"I Love Trains!",15.99,3.39432,4,2,2001,368131,"This book title, I Love Trains!, ISBN: 9780060289003, by Philemon Sturges, Shari Halpern, published by HarperCollins (April 24, 2001) is available in hardcover. Our minimum order quantity is 25 copies. All standard bulk book orders ship FREE in the continental USA and delivered in 4-10 business days."
234,9780060290160,"My Mommy Hung the Moon (A Love Story)",17.99,1.28483,4,3,2010,307683,"My mommy hung the moon.
She tied it with string.
My mommy's good at EVERYTHING."
235,9780060290337,"Cobweb Christmas (The Tradition of Tinsel)",17.99,4.92316,4,2,2001,177281,"This beautiful picture book about the warmth and wonder of Christmas and the origin of tinsel on trees will leave children enchanted with the magical possibilities of the season."
